{
  "schema": "source-coverage-v2",
  "rules": "steps-section-correspondence-v2",
  "metric": "source_step_correspondence",
  "case_id": "03-cell-lysate-preparation",
  "implementation": "0a6c98405cec902d8ea380114b3818c9e2ee1d69",
  "language_version": "1.0.7rc2",
  "source_sha256": "82b74d75d92bbeaae835c7196c39b7c50dbbe252172591d8c75860e92afc0249",
  "program_sha256": "22343c31c3df9a757c2ee0f25c68a064a0a7b8dea1a255ba9a3152f6c36f4f2b",
  "total_steps": 10,
  "matched_steps": 10,
  "coverage_percent": 100.0,
  "status": "pass",
  "issues": []
}
