{
  "schema": "source-coverage-v2",
  "rules": "steps-section-correspondence-v2",
  "metric": "source_step_correspondence",
  "case_id": "00",
  "implementation": "ab06a04446b51d208b6a8b6eb2b36853e67d0d7b",
  "language_version": "1.0.7rc1",
  "source_sha256": "c40f339607c679da8c43088d4c5a638a16078ce2123989ed0f8d34033df7da8b",
  "program_sha256": "cafc7063138f9fc72e295abb248e63a7a90b16e562867b5d6017017a113ad71f",
  "total_steps": 12,
  "matched_steps": 12,
  "coverage_percent": 100.0,
  "status": "pass",
  "issues": []
}
